Account,User Name,Followers at Posting,Created,Type,Likes,Retweets,URL,Message,Screen Name,Link 1,Final Link 1,Link 2,Final Link 2,Score
Søren Gade,SoerenGade,718,2019-04-16 14:28:55 EET,Tweet,7,1,https://twitter.com/SoerenGade/status/1118129141201670145,"EP stemmer i denne uge om at give udvidet adgang til danske velfærdsydelser. Gudskelov har EU-landene skudt den til hjørne. Dagsorden er ikke tabt endnu! Jeg vil kæmpe imod EU-borgeres udvidede adgang til danske velfærdsydelser, hvis jeg bliver valgt #dkpol #eudk",SoerenGade,,,,,1.0
Søren Gade,SoerenGade,711,2019-04-11 12:39:52 EET,Photo,8,1,https://twitter.com/SoerenGade/status/1116289759494721538,"De store butikskæder løfter kæmpe samfundsansvar! 30 millioner færre solgte cigaretter efter de er gemt væk. Håber FT følger trop med skrappere regler, så vi kan få antal af især yngre rygere ned. Vi sparer liv og menneskelig lidelse #dkpol https://t.co/HrP7r5PUnx",SoerenGade,https://t.co/HrP7r5PUnx,https://twitter.com/SoerenGade/status/1116289759494721538/photo/1,,,-2.4444444444444446
Søren Gade,SoerenGade,682,2019-04-09 14:30:36 EET,Tweet,209,18,https://twitter.com/SoerenGade/status/1115592847439192065,"“I dag flagede Danmark på halv indtil 12.00 for de 16 danskere, der mistede livet den 9. april 1940. Dem mindes vi i dag. Vigtig anledning til at huske at EU er et fredsprojekt, der blev skabt på ryggen af to verdenskrige” #dkpol #eudk",SoerenGade,,,,,28.375
Søren Gade,SoerenGade,680,2019-04-08 10:05:49 EET,Photo,62,8,https://twitter.com/SoerenGade/status/1115163827878936576,RT @ThDanielsen: Flere gode @venstre kræfter var i dag samlet på min hjemmebane på @NrVosborg 👍🏻 https://t.co/I4pCgKymp4,SoerenGade,https://t.co/I4pCgKymp4,https://twitter.com/ThDanielsen/status/1114858847989063682/photo/1,,,3.1818181818181817
Søren Gade,SoerenGade,650,2019-04-04 22:20:44 EET,Link,9,0,https://twitter.com/SoerenGade/status/1113899221906788352,Den ydre grænse skal lukkes - det skal vi bidrage til. Helt afgørende for at genetablere danskernes tillid til EU ovenpå migrationskrisen #dkpol https://jyllands-posten.dk/international/europa/ECE11300786/danmark-forlaenger-bidrag-til-eus-graense-og-kystagentur/,SoerenGade,https://jyllands-posten.dk/international/europa/ECE11300786/danmark-forlaenger-bidrag-til-eus-graense-og-kystagentur/,https://jyllands-posten.dk/international/europa/ECE11300786/danmark-forlaenger-bidrag-til-eus-graense-og-kystagentur/,,,1.0
Søren Gade,SoerenGade,650,2019-04-04 15:19:22 EET,Link,27,6,https://twitter.com/SoerenGade/status/1113793183002001408,"I dag har Europa-Parlamentet stemt for øremærket barsel. Jeg synes ikke, EU skal blande sig her. Det må være op til det enkelte medlemsland at indrette arbejdsmarkedet og i sidste ende op familien selv at vurdere, hvad der er bedst for dem #dkpol https://politiken.dk/udland/art7126223/EU-Parlamentet-godkender-%C3%B8rem%C3%A6rket-barsel-til-m%C3%A6nd",SoerenGade,https://politiken.dk/udland/art7126223/EU-Parlamentet-godkender-%C3%B8rem%C3%A6rket-barsel-til-m%C3%A6nd,https://politiken.dk/udland/art7126223/EU-Parlamentet-godkender-%C3%B8rem%C3%A6rket-barsel-til-m%C3%A6nd,,,3.6666666666666665
